Title,Authors,Year,Source/Venue,URL,Brief Description/Keywords
Re-Thinking Data Strategy and Integration for Artificial Intelligence,Abdel Magid Hamouda,2023,MDPI,https://www.mdpi.com/2076-3417/13/12/7082,"## Article Menu Font Type: _Arial__Georgia__Verdana_ Open AccessEditor’s ChoiceReview by Abdulaziz Aldoseri , Khalifa N. Al-Khalifa and Abdel Magid Hamouda \* Engineering Management Program, College o..."
Research Knowledge Graphs: the Shifting Paradigm of Scholarly Information Representation,8 Jun 2025,2025,arXiv,https://arxiv.org/abs/2506.07285,"Authors: [Matthäus Zloch](https://arxiv.org/search/cs?searchtype=author&query=Zloch,+M), [Danilo Dessì](https://arxiv.org/search/cs?searchtype=author&query=Dess%C3%AC,+D), [Jennifer D'Souza](https://a..."
AIstorian lets AI be a historian: A KG-powered multi-agent system for accurate biography generation,14 Mar 2025,2025,arXiv,https://arxiv.org/abs/2503.11346,"Authors: [Fengyu Li](https://arxiv.org/search/cs?searchtype=author&query=Li,+F) (1), [Yilin Li](https://arxiv.org/search/cs?searchtype=author&query=Li,+Y) (1), [Junhao Zhu](https://arxiv.org/search/cs..."
4th Workshop on Knowledge Graphs and Big Data,,2024,Other,https://cci.drexel.edu/kgbigdata/2024/,# 4th Workshop on Knowledge Graphs and Big Data In Conjunction with [IEEE Big Data 2024](http://bigdataieee.org/BigData2024/) ## SCOPE and OBJECTIVES #### Knowledge graphs have become essential tools ...
Oxford Semantic Technologies Knowledge Graph & AI | RDFox,Engineering DirectorDow Jones,,Other,https://www.oxfordsemantic.tech/,##### Product ##### Solutions ##### Resources ##### Company ## Transform data and knowledge into fast and accurate answers to complex questions. #### Knowledge-based artificial intelligence powered by...
Exploring Knowledge Graphs and Data Mining: A Quick ... - SmythOS,Alaa-eddine Kaddouri,2025,Other,https://smythos.com/developers/agent-development/knowledge-graphs-and-data-mining/,"Knowledge graphs are changing how we understand and process information with artificial intelligence. Like a vast digital map of interconnected facts and relationships, knowledge graphs help machines ..."
A literature review of current technologies on health data integration for patient-centered health management,"Cong Peng, Prashant Goswami, and Guohua Bai",2019,Other,https://bth.diva-portal.org/smash/get/diva2:1382796/FULLTEXT01,https://doi.org/10.1177/1460458219892387 Health Informatics Journal 1–26 © The Author(s) 2019 Article reuse guidelines: sagepub.com/journals-permissions DOI: 10.1177/1460458219892387 journals.sagepub....
Matching disparate dimensions for analytical integration of heterogeneous data sources,"Anna  Korobko, ICM SB RAS, Krasnoyarsk, Russia, Aleksei  Korobko, ICM SB RAS, Krasnoyarsk, Russia",2019,ACM Digital Library,https://dl.acm.org/doi/10.1145/3297662.3365809,"![logo](data:,) ## This website uses cookies We occasionally run membership recruitment campaigns on social media channels and use cookies to track post-clicks. We also share information about your us..."
Aggregation and exploration of heterogeneous data collected from diverse information sources,"Teruhiko  Teraoka, Yahoo Japan Corporation Tokyo, Japan, tteraoka@yahoo-corp.jp",1451,ACM Digital Library,https://dl.acm.org/doi/10.1145/2030066.2030076,This paper describes aggregation and exploration of heterogeneous data collected from various information sources. We studied the organization of such data from a user's point of view. Interactive vis...
[PDF] Data Management Opportunities in Unifying Large Language ...,"Arijit Khan, Tianxing Wu, and Xi Chen",,Other,https://vldb.org/workshops/2024/proceedings/LLM+KG/LLM+KG-1.pdf,Data Management Opportunities in Unifying Large Language Models+Knowledge Graphs Arijit Khan Aalborg University Denmark arijitk@cs.aau.dk Tianxing Wu Southeast University China tianxingwu@seu.edu.cn X...
[PDF] LLM Assisted Synthetic Multi-Modal Knowledge Graph Creation For ...,"Sukanya Mandal, Noel E. O'Connor",,Other,https://ojs.aaai.org/index.php/AAAI-SS/article/download/31795/33962/35864,"LLMasMMKG: LLM Assisted Synthetic Multi-Modal Knowledge Graph Creation For Smart City Cognitive Digital Twins Sukanya Mandal1, Noel E. O’Connor2 1SFI Centre for Research Training in Machine Learning (..."
Knowledge graphs | The Alan Turing Institute,,2025,Other,https://www.turing.ac.uk/research/interest-groups/knowledge-graphs,"# This site uses cookies to store information on your computer. We use cookies to improve your experience when you browse our website. Using cookies, the website can 'remember' you during a single vis..."
Agentic AI Research Team - 人工知能研究センター,,2025,Other,https://www.airc.aist.go.jp/en/dkirt/,[Top Page](https://www.airc.aist.go.jp/en/) [RESEARCH TEAMS](https://www.airc.aist.go.jp/en/teams/)Data-knolwedge Integration Research Team Research Teams - [Team Outline](https://www.airc.aist.go.jp/...
Knowledge Graphs: The AI Engine Powering Modern Business ...,"Joseph D. StecJuly 31, 2024",2024,Other,https://www.strategysoftware.com/blog/knowledge-graphs-the-ai-engine-powering-modern-business-intelligence,Ever wonder how Netflix suggests your next binge-worthy show—or how LinkedIn recommends new connections? Maybe you've thought about how investigators untangle complex financial fraud? The answer lies ...
Reframing a Novel Decentralized Knowledge Management Concept as a Desirable Vision: As We May Realize the Memex,Ulrich Schmitt,2021,MDPI,https://www.mdpi.com/2071-1050/13/7/4038/pdf,"sustainability Article Reframing a Novel Decentralized Knowledge Management Concept as a Desirable Vision: As We May Realize the Memex Ulrich Schmitt   Citation: Schmitt, U. Reframing ..."
Managing Polyglot Systems Metadata with Hypergraphs,"Moditha  Hewasinghage, Universitat Politècnica de Catalunya, BarcelonaTech, Barcelona, Spain, modith",2021,ScienceDirect,https://www.sciencedirect.com/science/article/pii/S0169023X21000239,[Skip to main content](https://www.sciencedirect.com/science/article/pii/S0169023X21000239#screen-reader-main-content) [Skip to article](https://www.sciencedirect.com/science/article/pii/S0169023X2100...
