Title,Authors,Year,Source/Venue,URL,Brief Description/Keywords
Microsoft Word - IEEE_Software_Connecting_the_Dots_of_Knowledge_in_Agile_Software_Development-3.docx,,2023,arXiv,https://export.arxiv.org/pdf/2306.05742v1.pdf,Month Published by the IEEE Computer Society Publication Name 1 K Abstract—This article discusses the importance of managing knowledge as a resource due to its great potential to create economic value...
Unifying context with labeled property graph: A pipeline-based system for comprehensive text representation in NLP,"O. Abend, A. Rappoport",2024,ScienceDirect,https://www.sciencedirect.com/science/article/pii/S0957417423027719,[Skip to main content](https://www.sciencedirect.com/science/article/pii/S0957417423027719#screen-reader-main-content) [Skip to article](https://www.sciencedirect.com/science/article/pii/S095741742302...
Knowledge-Based Version Incompatibility Detection for Deep Learning,"Zhao Zhong-kai,Kou, Bonan,Ibrahim, Mohamed Yilmaz,Muhao Chen,Tianyi Zhang",2023,arXiv,https://export.arxiv.org/pdf/2308.13276v2.pdf,Zhongkai Zhao zhongkai.zhaok@gmail.com Bonan Kou koub@purdue.edu Mohamed Yilmaz Ibrahim ibrahi35@purdue.edu Muhao Chen muhchen@ucdavis.edu Tianyi Zhang tianyi@purdue.edu Zhongkai Zhao Bonan Kou Mohame...
"Knowledge Graph Construction: Extraction, Learning, and Evaluation",Yuchul Jung,2025,MDPI,https://www.mdpi.com/2076-3417/15/7/3727,"## Article Menu Font Type: _Arial__Georgia__Verdana_ Open AccessReview by Seungmin Choi 1 and Yuchul Jung 2,\* 1 Department of Computer Engineering, Kumoh National Institute of Technology, Gumi-si 391..."
Explore-Construct-Filter: An Automated Framework for Rich and Reliable API Knowledge Graph Construction,19 Feb 2025,2025,arXiv,https://arxiv.org/abs/2502.13412,# Computer Science > Software Engineering **arXiv:2502.13412** (cs) \[Submitted on 19 Feb 2025\] # Title:Explore-Construct-Filter: An Automated Framework for Rich and Reliable API Knowledge Graph Cons...
Intelligent bug fixing with software bug knowledge graph,"Cheng  Zhou, Yangzhou University Yang zhou, China, canorcheng@foxmail.com",2018,ACM Digital Library,https://dl.acm.org/doi/10.1145/3236024.3275428,"![logo](data:,) ## This website uses cookies We occasionally run membership recruitment campaigns on social media channels and use cookies to track post-clicks. We also share information about your us..."
A solution and practice for combining multi-source heterogeneous data to construct enterprise knowledge graph,"Chenwei Yan, Xinyue Fang, Xiaotong Huang, Chenyi Guo, Ji Wu",2023,Other,https://www.frontiersin.org/journals/big-data/articles/10.3389/fdata.2023.1278153/full,"## 1\. Introduction A comprehensive understanding of enterprises and their associations is vital in the financial domain, as it benefits several real-world applications, such as fraud detection, risk ..."
Graph‐based Assessment and Analysis of System Architecture Models,"Leonard  Petnga, University of Alabama in Huntsville Huntsville, 35899, AL, leonard.petnga@uah.edu",1451,Other,https://incose.onlinelibrary.wiley.com/doi/10.1002/j.2334-5837.2019.00644.x,Graph‐based Assessment and Analysis of System Architecture Models - Petnga - 2019 - INCOSE International Symposium - Wiley Online Library Opens in a new windowOpens an external websiteOpens an externa...
A Novel Paper Recommendation Method Empowered by Knowledge Graph: for Research Beginners,"Bangchao Wang,Ziyang Weng,Yanping Wang",2021,arXiv,https://arxiv.org/pdf/2103.08819v1.pdf,Bangchao Wang School of Mathematics and Computer Science Wuhan Textile University WuhanChina School of Computer Science Wuhan University WuhanChina Ziyang Weng School of Information Management Wuhan U...
BEKG: A Built Environment Knowledge Graph,"Xiao-Jun Yang,Haoyu Zhong,Penglin Du,Keping Zhou,Xingjin Lai,Zhengdong Wang,Yik Lun Lau,Yangqiu Song",2022,arXiv,https://export.arxiv.org/pdf/2211.02864v1.pdf,Xiaojun Yang School of Information Engineering Guangdong University of Technology GuangzhouChina Haoyu Zhong School of Information Engineering Guangdong University of Technology GuangzhouChina Penglin...
Research on Driving Scenario Knowledge Graphs,Yier Lin,2024,MDPI,https://www.mdpi.com/2076-3417/14/9/3804,"## Article Menu Font Type: _Arial__Georgia__Verdana_ Open AccessArticle by Ce Zhang , Liang Hong , Dan Wang , Xinchao Liu , Jinzhe Yang and Yier Lin \* College of Mechanical Engineering, Tianjin Unive..."
A Polystore Architecture Using Knowledge Graphs to Support Queries on Heterogeneous Data Stores,"Leonardo Guerreiro Azevedo,Renan Souza,Elton Soares,Raphael Melo Thiago,Julio Tesolin,Oliveira, Ann ",2024,arXiv,https://export.arxiv.org/pdf/2308.03584v1.pdf,[![Cornell University](https://static.arxiv.org/icons/cu/cornell-reduced-white-SMALL.svg)](https://www.cornell.edu/) [We gratefully acknowledge support from\ \ the Simons Foundation and member institu...
Recommending Analogical APIs via Knowledge Graph Embedding,"Mingwei Liu,Yong Yang,Yiling Lou,Xin Peng,Zhong Zhang,Xueying Du,Tianlin Yang",2023,arXiv,https://export.arxiv.org/pdf/2308.11422v1.pdf,Mingwei Liu Yanjun Yang China Yiling Lou Xin Peng Zhong Zhou China Xueying Du China Tianyong Yang * M Liu Y Yang Y Lou X Peng Z Zhou X Du T Yang Mingwei Liu Yanjun Yang Yiling Lou yilinglou@fudan.edu....
Integrating collective know-how for multicriteria decision support in agrifood chains—application to cheesemaking,Patrice Buche,2023,Other,https://www.frontiersin.org/articles/10.3389/frai.2023.1145007/pdf?isPublishedV2=False,"TYPE Original Research PUBLISHED 28 April 2023 DOI 10.3389/frai.2023.1145007 OPEN ACCESS EDITED BY Christophe Guéret, Accenture, Ireland REVIEWED BY Donagh Berry, Teagasc Food Research Centre, Ireland..."
Building a Knowledge Base of Bridge Maintenance Using Knowledge Graph,Yang Zhang,2023,Other,https://onlinelibrary.wiley.com/doi/10.1155/2023/6047489,"[Advances in Civil Engineering](https://onlinelibrary.wiley.com/journal/7074) [Volume 2023, Issue 1](https://onlinelibrary.wiley.com/toc/7074/2023) 6047489 [![Advances in Civil Engineering](https://on..."
Challenges and Paths Towards AI for Software Engineering,,2025,arXiv,https://arxiv.org/html/2503.22625v1,"\\nameAlex Gu \\emailgua@mit.edu \\addrMIT CSAIL \\nameNaman Jain⋆\\emailnaman\_jain@berkeley.edu \\addrUniversity of California, Berkeley \\nameWen-Ding Li⋆\\emailwl678@cornell.edu \\addrCornell Univ..."
Adoption of knowledge-graph best development practices for scalable and optimized manufacturing processes - PubMed,"M S Jawad 1 2 ,",2023,PubMed,https://pubmed.ncbi.nlm.nih.gov/36974325,"## Erratum in - [Corrigendum to ""Adoption of knowledge-graph best development practices for scalable and optimized manufacturing processes"" \[MethodsX Volume 10(2023) 102124\].](https://pubmed.ncbi.nl..."
Foundation Models for Software Engineering of Cyber-Physical Systems: the Road Ahead,6 Apr 2025,2025,arXiv,https://arxiv.org/abs/2504.04630,"[View PDF](https://arxiv.org/pdf/2504.04630) [HTML (experimental)](https://arxiv.org/html/2504.04630v1) > Abstract:Foundation Models (FMs), particularly Large Language Models (LLMs), are increasingly ..."
